{
  "$format": "kickstartds/component-contract@1",
  "anatomy": {
    "children": [
      {
        "classes": [
          "dsa-breadcrumb__icon",
          "icon"
        ],
        "element": "svg",
        "gate": {
          "prop": "pages",
          "when": "non-empty"
        },
        "namedBy": "bem-class",
        "observedIn": [
          "corporate-breadcrumb--default"
        ],
        "path": "root/icon",
        "presence": "repeated",
        "role": "glyph"
      },
      {
        "classes": [
          "dsa-breadcrumb__label"
        ],
        "element": "span",
        "gate": {
          "prop": "pages",
          "when": "non-empty"
        },
        "namedBy": "bem-class",
        "observedIn": [
          "corporate-breadcrumb--default"
        ],
        "path": "root/label",
        "presence": "conditional",
        "role": "text"
      },
      {
        "classes": [
          "dsa-breadcrumb__link"
        ],
        "element": "a",
        "gate": {
          "prop": "pages",
          "when": "non-empty"
        },
        "namedBy": "bem-class",
        "observedIn": [
          "corporate-breadcrumb--default"
        ],
        "path": "root/link",
        "presence": "repeated",
        "role": "control"
      }
    ],
    "classes": [
      "dsa-breadcrumb"
    ],
    "element": "div",
    "namedBy": "root",
    "path": "root",
    "presence": "always",
    "role": "container",
    "tokens": [
      "--dsa-breadcrumb--color",
      "--dsa-breadcrumb--color_active",
      "--dsa-breadcrumb--color_hover",
      "--dsa-breadcrumb--font",
      "--dsa-breadcrumb--gap",
      "--dsa-breadcrumb__icon--color",
      "--dsa-breadcrumb__icon--size"
    ]
  },
  "api": {
    "props": {
      "pages": {
        "role": "composition",
        "type": "array"
      }
    },
    "required": [],
    "schema": "./breadcrumb.schema.dereffed.json"
  },
  "axes": [],
  "bindings": [
    {
      "mechanism": "presence",
      "parts": [
        "root/icon",
        "root/label",
        "root/link"
      ],
      "prop": "pages"
    }
  ],
  "component": "Breadcrumb",
  "composition": {
    "slots": [
      {
        "itemShape": [
          "label",
          "url"
        ],
        "observedCounts": [
          0,
          3
        ],
        "part": "root/link",
        "prop": "pages"
      }
    ]
  },
  "contractId": "breadcrumb",
  "coverage": {
    "axes": {},
    "baseline": {
      "emptySlots": [
        "pages"
      ],
      "fromExample": 0,
      "placeholders": 0,
      "values": 1
    },
    "combinations": {
      "possible": 2,
      "proven": 2
    },
    "parts": {
      "conditional": 3,
      "inDefault": 1,
      "total": 4
    },
    "score": null,
    "stories": {
      "failed": 0,
      "observed": 1
    }
  },
  "default": {
    "configuration": {
      "pages": {
        "source": "schema-default",
        "value": []
      }
    },
    "evidence": {
      "screenshot": "img/screenshots/contract-defaults-breadcrumb--contract-default.png",
      "story": "contract-defaults-breadcrumb--contract-default"
    },
    "parts": {
      "root": {
        "box": {
          "height": 0,
          "width": 1440
        },
        "layout": {
          "alignItems": "flex-start",
          "display": "flex",
          "gap": "5.77082px"
        },
        "styles": {
          "color": {
            "computed": "rgb(0, 0, 0)",
            "resolves": "--ks-text-color-interface-interactive",
            "token": "--dsa-breadcrumb--color"
          },
          "font": {
            "computed": "400 14.1432px 21.2147px Montserrat",
            "resolves": "--ks-font-interface-xs",
            "token": "--dsa-breadcrumb--font"
          },
          "gap": {
            "computed": "5.77082px 5.77082px",
            "resolves": "--ks-spacing-xxs",
            "token": "--dsa-breadcrumb--gap"
          }
        }
      }
    }
  },
  "description": "Breadcrumb navigation component used to indicate the current page's location within a navigational hierarchy.",
  "generated": {
    "inputs": {
      "schema": "sha256:6f7fdbc7fb0a9082",
      "stories": "sha256:f55ecaa5ec5b7634",
      "tokens": "sha256:89c2f0dc7d4f152b"
    },
    "theme": "default",
    "viewport": {
      "height": 900,
      "width": 1440
    }
  },
  "issues": [],
  "variants": [
    {
      "evidence": {
        "screenshot": "img/screenshots/corporate-breadcrumb--default.png",
        "story": "corporate-breadcrumb--default"
      },
      "parts": {
        "root": {
          "box": {
            "height": 21,
            "width": 1440
          },
          "styles": {
            "height": {
              "from": "0px",
              "to": "21.2031px"
            }
          }
        },
        "root/icon": {
          "box": {
            "height": 21,
            "width": 21
          },
          "classes": [
            "dsa-breadcrumb__icon",
            "icon"
          ],
          "introduced": true
        },
        "root/label": {
          "box": {
            "height": 21,
            "width": 49
          },
          "classes": [
            "dsa-breadcrumb__label"
          ],
          "introduced": true
        },
        "root/link": {
          "box": {
            "height": 21,
            "width": 46
          },
          "classes": [
            "dsa-breadcrumb__link"
          ],
          "introduced": true
        }
      },
      "when": {}
    }
  ]
}
